chapter	id	size	necessary count	necessary percentage	unnecessary count	unnecessary percentage	sentence
emma_036	1	53	3	6	8	15	the remaining five were left to their own powers and emma doubted their getting on very well for mr knightley seemed little disposed for conversation mrs elton was wanting notice which nobody had inclination to pay and she was herself in a worry of spirits which would have made her prefer being silent
emma_036	2	50	1	2	4	8	he was to leave them early the next day and he soon began with well emma i do not believe i have any thing more to say about the boys but you have your sister s letter and every thing is down at full length there we may be sure
emma_036	3	35	1	3	2	6	i rather hope to satisfy you both said emma for i shall do all in my power to make them happy which will be enough for isabella and happiness must preclude false indulgence and physic
emma_036	4	34	0	0	3	9	very well and as randalls i suppose is not likely to have less influence than heretofore it strikes me as a possible thing emma that henry and john may be sometimes in the way
emma_036	5	8	1	12	1	12	upon my word exclaimed emma you amuse me
emma_036	6	60	0	0	5	8	and as to my dear little boys i must say that if aunt emma has not time for them i do not think they would fare much better with uncle knightley who is absent from home about five hours where she is absent one and who when he is at home is either reading to himself or settling his accounts
