chapter	id	size	necessary count	necessary percentage	unnecessary count	unnecessary percentage	sentence
mansfield_034	1	77	0	0	9	12	he staid of course and edmund had then ample opportunity for observing how he sped with fanny and what degree of immediate encouragement for him might be extracted from her manners and it was so little so very very little every chance every possibility of it resting upon her embarrassment only if there was not hope in her confusion there was hope in nothing else that he was almost ready to wonder at his friend s perseverance
mansfield_034	2	52	4	8	4	8	edmund saw it all and saw fanny so determined  not  to see it as to make it clear that the voice was enough to convey the full meaning of the protestation and such a quick consciousness of compliment such a ready comprehension of a hint he thought was rather favourable than not
mansfield_034	3	118	2	2	7	6	the two young men were the only talkers but they standing by the fire talked over the too common neglect of the qualification the total inattention to it in the ordinary school system for boys the consequently natural yet in some instances almost unnatural degree of ignorance and uncouthness of men of sensible and well informed men when suddenly called to the necessity of reading aloud which had fallen within their notice giving instances of blunders and failures with their secondary causes the want of management of the voice of proper modulation and emphasis of foresight and judgment all proceeding from the first cause want of early attention and habit and fanny was listening again with great entertainment
mansfield_034	4	33	1	3	3	9	perhaps sir said fanny wearied at last into speaking perhaps sir i thought it was a pity you did not always know yourself as well as you seemed to do at that moment
mansfield_034	5	54	2	4	5	9	crawford delighted to get her to speak at any rate was determined to keep it up and poor fanny who had hoped to silence him by such an extremity of reproof found herself sadly mistaken and that it was only a change from one object of curiosity and one set of words to another
mansfield_034	6	22	2	9	2	9	none such had occurred since his seeing her in her uncle s room none such might occur again before his leaving mansfield
mansfield_034	7	44	2	5	6	14	but though the conference had seemed full long to him and though on looking at fanny he saw rather a flush of vexation he inclined to hope that so much could not have been said and listened to without some profit to the speaker
