chapter	id	size	necessary count	necessary percentage	unnecessary count	unnecessary percentage	sentence
persuasion_009	1	22	0	0	2	9	which of the two sisters was preferred by captain wentworth was as yet quite doubtful as far as anne s observation reached
persuasion_009	2	78	0	0	8	10	there was not the smallest appearance of solicitude or remark about them in the mansion house but it was different at the cottage the young couple there were more disposed to speculate and wonder and captain wentworth had not been above four or five times in the miss musgroves company and charles hayter had but just reappeared when anne had to listen to the opinions of her brother and sister as to which was the one liked best
persuasion_009	3	71	1	1	7	10	charles may say what he pleases cried mary to anne as soon as he was out of the room but it would be shocking to have henrietta marry charles hayter a very bad thing for her and still worse for me and therefore it is very much to be wished that captain wentworth may soon put him quite out of her head and i have very little doubt that he has
persuasion_009	4	44	2	5	2	5	a dinner at mr musgrove s had been the occasion when all these things should have been seen by anne but she had staid at home under the mixed plea of a headache of her own and some return of indisposition in little charles
persuasion_009	5	27	3	11	3	11	she had thought only of avoiding captain wentworth but an escape from being appealed to as umpire was now added to the advantages of a quiet evening
persuasion_009	6	42	1	2	3	7	one morning very soon after the dinner at the musgroves at which anne had not been present captain wentworth walked into the drawing room at the cottage where were only herself and the little invalid charles who was lying on the sofa
persuasion_009	7	64	1	2	5	8	they are up stairs with my sister they will be down in a few moments i dare say had been anne s reply in all the confusion that was natural and if the child had not called her to come and do something for him she would have been out of the room the next moment and released captain wentworth as well as herself
persuasion_009	8	50	3	6	3	6	she hoped on turning her head to see the master of the house but it proved to be one much less calculated for making matters easy charles hayter probably not at all better pleased by the sight of captain wentworth than captain wentworth had been by the sight of anne
persuasion_009	9	9	1	11	0	0	she only attempted to say how do you do
